Id	CharacterId	Type	UnlockType	UnlockPara	Title	Content	Picture	ConditionDescript	PreviewPicture
343	1021004	1	1	3	Plume's Secret 3	Sometimes appears in front of people in a different hair style. The twin-tails are one of her favorite at the moment.		Affection 3	
344	1021004	1	1	3	Plume's Secret 4	Undertook some high-speed sprint training using her "Feather" thruster at the back, but fell over due to charging too much power.		Affection 3	
345	1021004	1	1	4	Plume's Secret 5	Once considered whether she should apply to change the shape of her thrusters to wing-like, but decided to keep them as they were.		Affection 4	
346	1021004	1	1	4	Plume's Secret 6	The size of her frog plushies keeps getting bigger.		Affection 4	
347	1021004	1	1	5	Plume's Secret 7	The food she cooks have perfect presentation and fragrance. Many non-Gray Raven colleagues fell for it.		Affection 5	
348	1021004	1	1	5	Plume's Secret 8	She seems to be lost in her own thoughts more often than ever. But unlike before, she now gives a reassuring smile.		Affection 5	
349	1021004	1	1	6	Plume's Secret 9	The emotion module of her new frame has been configured by some unknown authorized personnel. It cannot be turned off now.		Affection 6	
350	1021004	1	1	6	Plume's Secret 10	When her memory data was being lost, the parts related to the commandant was the last to be forgotten.		Affection 6	