Id	BornMagic[1]	BornMagic[2]	BornMagic[3]	SubSkillId[1]	SubSkillId[2]	SubSkillId[3]	Ability	Icon	Name	Description
101	510901						100	Assets/Product/Texture/Image/IconSkill/IconSkillEquipShuchuGuozaiqinxie.png	Incandescence	Weapon's final ATK is increased by 15% at the start of battle. No duration limit.
102	511001						100	Assets/Product/Texture/Image/IconSkill/IconSkillEquipShuchuGuozaibiaoji.png	Dead Point Countdown	Gain 1 additional Signal Orb at the start of battle, and 3 identical Signal Orbs every 45s.
103	509201						100	Assets/Product/Texture/Image/IconSkill/IconSkillEquipTongyongGandianshanbi.png	Matrix Lightning	After EX Dodge, Movement Speed is greatly increased and all enemies' Extra DMG Reduction is decreased by 10% in Matrix.
201	510901						100	Assets/Product/Texture/Image/IconSkill/IconSkillEquipShuchuGuozaiqinxie.png	Incandescence	Weapon's final ATK is increased by 15% at the start of battle. No duration limit.
202	511001						100	Assets/Product/Texture/Image/IconSkill/IconSkillEquipShuchuGuozaibiaoji.png	Dead Point Countdown	Gain 1 additional Signal Orb at the start of battle, and 3 identical Signal Orbs every 45s.
203	509201						100	Assets/Product/Texture/Image/IconSkill/IconSkillEquipTongyongGandianshanbi.png	Matrix Lightning	After EX Dodge, Movement Speed is greatly increased and all enemies' Extra DMG Reduction is decreased by 10% in Matrix.
301	512005						100	Assets/Product/Texture/Image/IconSkill/IconSkillEquipTongyongGandianshanbi.png	Matrix Outburst	All DMG increases by 15% when in Matrix.
302	512007						100	Assets/Product/Texture/Image/IconSkill/IconSkillEquipShuchuGuozaibiaoji.png	Overload Signal	An Entrance Skill grants 1 additional Signal Orb. Extra DMG Bonus of Signal Orb Skills increases by 10% for 8s.
303	512012						100	Assets/Product/Texture/Image/IconSkill/IconSkillEquipShuchuGuozaiqinxie.png	Limit Break	All ATK increases by 10%.
401	512005						100	Assets/Product/Texture/Image/IconSkill/IconSkillEquipTongyongGandianshanbi.png	Matrix Outburst	All DMG increases by 15% when in Matrix.
402	512007						100	Assets/Product/Texture/Image/IconSkill/IconSkillEquipShuchuGuozaibiaoji.png	Overload Signal	An Entrance Skill grants 1 additional Signal Orb. Extra DMG Bonus of Signal Orb Skills increases by 10% for 8s.
403	512012						100	Assets/Product/Texture/Image/IconSkill/IconSkillEquipShuchuGuozaiqinxie.png	Limit Break	All ATK increases by 10%.
2013001							0			
2014001	501001						0		Resonance Vibration	Physical DMG increased by 15% when combo is greater than 50.
2015001	501101						0		Saturated Loading	Pinging all 3 types of Signal Orbs within 5s increases Extra DMG Bonus by 15% for 5s. Duration resets every time it is triggered.
2015002	501201						0		Dodge Echo	ATK is increased by 30% for 4s after an EX Dodge.
2016001	501301	501303					0		Predator's Maxim	Extra DMG Bonus increases by 20% when attacking enemies in a burning area.
2016002	501306						0		Cycle of Stars	Increases Skill - Space Lord's Extra DMG Bonus by 10%. Physical DMG is increased by 15% for 5s after a 3-Ping. Duration resets every time it is triggered.
2016003	501315						0		Measurement Theory	When picking up an Energy Ball, increases Extra DMG Bonus by 3% for 5s. Can be stacked up to 5 times. For every 5 Energy Balls picked up, gains an additional random Signal Orb and 10 Energy. 10s cooldown.
2022001							0			
2023001							0			
2024001	502001						0		Unbranded Slash	Extra DMG Bonus of Red Orb skills increases by 15%.
2025001	502101						0		Phantom Sword	Attacks have a 20% chance to call down a lightning strike that deals 50% Physical DMG. 3s cooldown.
2025002	502201						0		One With Armor	ATK is increased by 30% for 4s after an EX Dodge.
2026001	502301	502303	502306				0		Blade of Fury	Basic Attack DMG increases by 10%. Physical DMG increases by 5% for 2s after each Basic Attack. Can be stacked up to 5 times. Duration resets every time it is triggered.
2026002	502308	502315	502309				0		Inverse Shadow	Lightning DMG Bonus increases by 5% for 4s when dealing Lightning DMG. Can be stacked up to 4 times. Signature Move increases own Extra DMG Bonus by 10% for 10s. Both duration will reset every time it is triggered.
2026003	600602	600601					0		Energy Incarnate	Extra DMG Bonus increases by 5%. Pinging orbs will accumulate energy based on the number of orbs pinged. Consumes 50 energy to summon Sirius for 45s. 60s cooldown.          Its power as a weapon is nothing to write home about, but it is much sought after for its attractive appearance.
2026004	502320						0		Falling Blossoms	For each orb pinged, Physical DMG increases by 2% for 5s. Can be stacked up to 10 times. Duration resets every time it is triggered. Gains an extra Swordwave Orb in Swordwave Mode. 10s cooldown.
2026005	502326	502327					0		Crimson Snow	Ice DMG increased by 15%. After a 3-Ping, All DMG is increased by 10% for 5s.
2026006	502330						0		Bramble Heart	Dark DMG increases by 15%. Attacks have a 15% chance to unleash a shadow wave, dealing 75% Dark DMG. 0.5s cooldown.
2032001							0			
2033001							0			
2034001	503001						0		Deep Pursuit	Basic Attack's Extra DMG Bonus increases by 10%.
2035001	503101						0		Chain Combo	Gains 1 random Signal Orb every 30 combos. 8s cooldown.
2035002	503201						0		Jet Boost	ATK increased by 20% for 4s after an EX Dodge. Gain 1 Signal Orb when the effect ends.
2036001	503301	503303	503309				0		Original Number	Laser Shot's Extra DMG Bonus increases by 50%. Gains 15% ATK after a 3-Ping for 5s. Duration resets every time it is triggered.
2036002	503311	503313	503315				0		Ring of Praise	For every 12 orbs pinged, increases Extra DMG Bonus of the allies within 5m by 10% for 5s. Duration resets every time it is triggered. When attacking Imprisoned enemies, Extra DMG Bonus increases by 10%.
2036003	503317	503325					0		Storm Hunt	Basic Attacks have a 10% chance to inflict Frail, reducing the target's ATK by 10% for 5s. Duration resets every time it is triggered. Attacking a Frail enemy has a 10% chance to restore 1 Signal Orb. 6s cooldown.
2043001							0			
2044001	504001						0		Concentrated Neutralization	Physical DMG increased by 15% if you attack the same target for 5s.
2045001	504101						0		Sharpshooter	CRIT Rate and CRIT DMG increased by 10% if there are no enemies within 2m.
2045002	504201						0		New Moon	ATK is increased by 30% for 4s after an EX Dodge.
2046001	504301	504305					0		Now, I Am the Master	Signature Move's Extra DMG Bonus increases by 15%. Signature Move reduces its target's Physical Resistance by 2% for 5s per hit. Can be stacked up to 8 times. Duration resets every time it is triggered.
2046002	504310	504316					0		Raging Tempest	Lightning DMG is increased by 15%. When dealing Lightning DMG caused by skills to the same target 5 times, calls down a lightning strike that deals 150% Lightning DMG. 2s cooldown.
2053001							0			
2054001	505001						0		Shed Excess	Physical DMG increased by 10% for 3s when switching targets.
2055001	505101						0		Echo Halls	Attacks have a 30% chance to inflict Broken Armor, reducing an enemy's DEF by 5% for 3s. Can be stacked up to 5 times. Duration resets every time it is triggered.
2055002	505201						0		Chain of Stars	ATK is increased by 30% for 4s after an EX Dodge.
2056001	505301	505304	505307				0		Fusion Shadow	Attacks have a 20% chance to inflict Breach, dealing 2% Physical DMG per second for 3s. The chance is doubled if the enemy's DEF has been reduced. Can be stacked up to 10 times. Duration resets every time it is triggered. Physical DMG increases by 10% when attacking a Breached enemy.
2056002	505310	505316					0		Fire Chain	Attacks have a 10% chance to reduce the target's Fire Resistance by 5% for 5s. 8s cooldown against the same target. A Signature Move increases Fire DMG by 20% and doubles the chance of reducing the target's Resistance.
2063001							0			
2064001	506001						0		Precision Suppression	The first Basic Attack hit on a target is guaranteed to be a Critical Hit. 15s cooldown against the same target.
2065001	506101						0		Variable Arms	Attacks have a 10% chance to unleash a shockwave, dealing 100% Physical DMG to enemies in the area.
2065002	506201						0		One With Armor	ATK is increased by 30% for 4s after an EX Dodge.
2065050	506210						0		Merry Christmas!	3-Ping skills create a Christmas aura that increases the Movement Speed and ATK by 8% for 15s. 30s cooldown.
2066001	506301	506303	506309				0		Unified Will	Physical DMG increases by 15%. Upon a successful parry, Extra DMG Bonus of the next skill increases by 30%.
2066002	506311	506314					0		Shadow Burst	After a 3-Ping, Physical DMG and Dark DMG dealt increase by 20% for 5s. Duration resets every time it is triggered.
2073001							0			
2074001	507001						0		Broken Helix	Basic Attack DMG increased by 10%.
2075001	507101						0		Unquenchable	ATK increases by 12% for 4s after a 3-Ping. Duration resets every time it is triggered.
2075002	507207						0		Light Firecrackers	When Artillery Tactics or Thermal Armament is active, dealing damage causes a firecracker explosion at the target location, inflicting a total of 250% Physical DMG. 10s cooldown.
2076001	507301	507302	507305				0		Chaos Particle	Physical DMG increases by 10%. After a 3-Ping, Basic Attack's Extra DMG Bonus increases by 30% for 5s. Duration resets every time it is triggered.
2076002	507307	507308	507310				0		Raging Red	Fire DMG increases by 10%. Pinging Red Orbs increases Fire DMG by 10% for 5s. Duration resets every time it is triggered.
2083001							0			
2084001	508001						0		Silent Hunter	Movement Speed is increased by 30% and ATK is increased by 10% for 3s after a 3-Ping. Duration resets every time it is triggered.
2085001	508101						0		Heart of Gravel	Extra DMG Bonus increases by 15% for 5s after performing a 3-Ping consecutively. Duration resets every time it is triggered.
2085002	508210						0		Fallen Yuanxiao	Dealing DMG has a 20% chance to release a Yuanxiao that deals 15% Physical DMG. 1s cooldown.
2086001	508301	508304	508306				0		Zero Pierce	Dealing a Critical Hit from behind inflicts Breach, dealing 50% Physical DMG per second for 3s. Duration resets every time it is triggered. Physical DMG increases by 20% when attacking a Breached enemy.
2086002	508310	508312					0		Soul Strike	Extra DMG Bonus increases by 10%. Dark DMG increases by 10% while under Cosmic Wave state.
2991001							0			
2992001							0			
2993001							0			
2994001							0			
2093001							0			
2094001	531001						0		Color of Bleakness	Extra DMG Bonus increases by 7% when attacking enemies with Super Armor.
2095001	531101						0		Line Drawing	Extra DMG Bonus increases by 10% for 4s when performing a QTE or 3-Ping skill. Duration resets every time it is triggered.
2096001	531301	531307	531309				0		Color Splash	Extra DMG Bonus increases by 2% for 5s when dealing DMG to enemies with Super Armor. Can be stacked up to 3 times. Duration resets every time it is triggered. Stuns an enemy for 2s when breaking its Super Armor. 10s cooldown for the same target. Physical DMG increases by 15% for 7s when releasing Vector Cube. Duration resets every time it is triggered.
2096002	531311	531312					0		St. Elmo's Fire	Lightning DMG increases by 10%. No. of Lightning Strikes required to trigger Core Passive reduced to 3 under "Signature - Lightning Charge".
2104001	512001						0		Photophage Phantom	Basic Attack DMG increases by 10%.
2105001	512003						0		Rageful Abyss	After a 3-Ping, Extra DMG Bonus is increased by 12% for 4s.
2106001	512030						0		Solar Cleave	Extra DMG Bonus increases by 15%. When Camu: Crocotta enters Berserk, Thanatos will continuously increase Dark DMG for characters on the battlefield by 10%.