Id	Key	Text
40001023	AccumulatePayRewardMoneyNotEnough	Insufficient recharge amount
40001024	PayUnsupportedTargetType	Payment processing method unsupported
40001025	PayInvalidPlatformForPay	Payment platform settings invalid
40001026	PayPlatformPayKeyNotMatch	PayKey mismatched
40001027	PayModuleNotHandled	Did not perform payment module processing
20053101	PurchaseExistMutexItem	Already own a conflicting product. Cannot purchase and replace it now.
20140001	SlotMachinesTemplateNotFound	detector settings not found
20140002	SlotMachinesIconTemplateNotFound	detector symbol settings not found
20140003	SlotMachinesActivityTemplateCanNotFound	detector event not found
20140004	SlotMachinesTemplateIconNotFound	detector symbols not found
20140005	SlotMachinesActivityNotOpen	Event is not available yet
20140006	SlotMachinesActivityIsNotFound	Event is over
20140007	SlotMachinesScoreAlreadyFull	Points full
20140008	SlotMachinesStartConfigNeedPerUnlock	Need to complete the Common Detector before unlocking the Wide-Range Detector
20140009	SlotMachinesPerDataIsNull	No prerequisite detector data
20140010	SlotMachinesNeedAchievePerUnlockScore	Points must reach unlock prerequisite
20140011	SlotMachinesReceiveRewardNotExist	Rewards to claim does not exist
20140012	SlotMachinesScoreIsNotEnough	Not enough points. Cannot claim.
20140013	SlotMachinesRewardIsAlreadyReceive	Reward claimed
20140014	SlotMachinesRockTypeNotFound	detector error
20140015	SlotMachinesCoinEnoughNotNeedBuy	Enough Cell Battery, no need to purchase
20140016	SlotMachinesBuyNumNoMatchNeedNum	The quantity purchased don't match the quantity required
